1257486,2017-06-22,"Credit reporting, credit repair services, or other personal consumer reports",Credit reporting,Incorrect information on your report,Information belongs to someone else,"I am a victim of identity theft and have been a victim of identity theft for well over 11 years. I have an unauthorized and fraudulent account listed on my XXXX XXXX, XXXX and Experian credit report that 's fraudulent. The following account is fraudulent : XXXX XXXX XXXX account : XXXX. Please permanently delete this fraudulent account from my credit report.",Company has responded to the consumer and the CFPB and chooses not to provide a public response,Experian Information Solutions Inc.,ND,58201.0,Servicemember,Consent provided,Web,2017-06-22,Closed with non-monetary relief,Yes,,2555961,360,2147,2555961,1
1225245,2023-01-18,"Credit reporting, credit repair services, or other personal consumer reports",Credit reporting,Problem with a credit reporting company's investigation into an existing problem,Their investigation did not fix an error on your report,I'm really not sure what happened. I have mailed off letters to the credit bureaus continuously and thus far I have not gotten a response. My name is XXXX XXXX XXXX and I am filing this complaint for falsely reporting misleading information. There is no third party involved. Please review the uploaded letters.,Company has responded to the consumer and the CFPB and chooses not to provide a public response,Experian Information Solutions Inc.,CT,06360,,Consent provided,Web,2023-01-18,Closed with explanation,Yes,,6454076,311,111,6451936;6454076,2
979012,2021-06-22,"Money transfer, virtual currency, or money service",Domestic (US) money transfer,Other transaction problem,,"On XX/XX/21 I've sent {$1000.00} from my Bank of America Account to XXXX ( so they could forward the money to XXXX ). 
The "" receiving bank '' for XXXX  XXXX was XXXX XXXX. 

Since then, I've never seen my money again. Bank of America has shared confirmation numbers for the transfer and has informed they tried to recall the payment but they couldn't get in touch with XXXX or the receiving bank. Bofa tells me I need to reach out to XXXX. 

I've provided all the available information to XXXX but they say they have never received the money - and that I need to sort this out with Bofa. 

This has been a nightmare, {$1000.00} is making a huge difference to us in XXXX and we feel unsupported by the two institutions involved in the transaction.",Company has responded to the consumer and the CFPB and chooses not to provide a public response,"BANK OF AMERICA, NATIONAL ASSOCIATION",,,,Consent provided,Web,2021-06-22,Closed with explanation,Yes,,4483193,747,686,4483193,1
415909,2021-06-23,Credit card or prepaid card,General-purpose credit card or charge card,Problem with a purchase shown on your statement,Credit card company isn't resolving a dispute about a purchase on your statement,"XXXX  mastercard is charging me for an amount that they already refunded to to a charge made on my account that was not made by me. XX/XX/XXXX, XX/XX/XXXX, and XX/XX/XXXX, I was charged {$10.00} each month for XXXX which I did not purchase. I called and disputed these charges and XXXX refunded my account. I closed this account afterwards due to the annual fee and they reinstated these charges. I've called several times to resolve this and the last call I was informed that a supervisor would call me back ... This has not happened. I would like to file a complaint and know what my rights are as they are trying to extort money out of me because I simply closed the account. I have the letter of dispute and the final statement that shows a XXXX  balance which should have been enough, but XXXX told me that it doesn't matter and the charges are valid. All files are electronic and now I can only access back to XX/XX/XXXX ... ..",Company has responded to the consumer and the CFPB and chooses not to provide a public response,"Continental Finance Company, LLC",PA,19154,,Consent provided,Web,2021-06-23,Closed with explanation,Yes,,4486612,933,685,4486612,1
659129,2022-07-15,"Credit reporting, credit repair services, or other personal consumer reports",Credit reporting,Problem with a credit reporting company's investigation into an existing problem,Their investigation did not fix an error on your report,"When I investigated my credit report, I realized that some of the information was erroneous. The 3 credit bureaus are required to authenticate this account under Sections 609 ( a ) ( 1 ) ( A ) and 611 ( a ) ( 1 ). ( A ). It is not acceptable to treat this reporting account as unconfirmed information without producing proof within the legal time range. Sections 609 ( a ) ( 1 ) ( A ) and 611 ( a ) ( 1 ). ( A ), please investigate the unverifiable account below : XXXX XXXX XXXX Date Opened : XX/XX/2021 Balance : {$41.00}.",,"EQUIFAX, INC.",CA,95823.0,,Consent provided,Web,2022-07-15,Closed with explanation,Yes,,5772360,524,298,5772359;5772360;5772368;5772374,4
150028,2019-10-19,Credit card or prepaid card,General-purpose credit card or charge card,"Other features, terms, or problems",Other problem,"The main reason for this complaint is XXXX XXXX ( Goldman Sachs ) failure to close account and being misleading about it. 

1 ) On XX/XX/2019, I paid off the balance on my XXXX XXXX ( the account balance was XXXX ) and closed the account by calling XXXX. After a brief conversation, the XXXX XXXX agent assured me this had been done. However, I did not receive a confirmation of the account closure. 

2 ) Today, XX/XX/2019, I called again ( at the same number ) to confirm the account closure and was told the account was still active and only the credit card had been canceled. ( I was surprised because on XX/XX/2019 when I contacted XXXX XXXX/Goldman Sachs, I recall I was clear that I wanted to close the account and did not say anything to suggest the card had been lost. ) I expressed this to the agent and asked again to close the account. She first asked me to agree to a statement and when I agreed she assured me the account had been closed. She said I would receive a confirmation but as I write this complaint, I have not received one. 

The following information also raises concerns about XXXX XXXX security : 1 ) For security and convenience reasons, I tried to change my Apple Card billing address from my apartment address to the same address I use with my other cards ( a PO box ). I tried to do this in the XXXX app, but the update failed with no explanation provided. I tried twice. 

2 ) I called XXXX XXXX support and was told I could change the billing address only when I had a physical card. Even though I didn't want a physical card, I ordered one. 

3 ) When the card arrived, I tried again to change my billing address in the XXXX app, but ran into the same problem as in ( 1 ). 

4 ) I called XXXX XXXX support again and was told I would not be able to change my billing address after all. I told them that I had been informed previously this would be possible if I had a physical card. The agent told me there had been a policy change. 
5 ) I also tried to change my email address to a safer, non-generic email address. I called the customer service but was not able to get an answer on how to do this.

6 ) I decided to cancel the account.",,GOLDMAN SACHS BANK USA,NY,10023.0,,Consent provided,Web,2019-10-19,Closed with explanation,Yes,,3411021,2171,1298,3411021,1
1071159,2017-08-10,"Credit reporting, credit repair services, or other personal consumer reports",Credit reporting,Problem with a credit reporting company's investigation into an existing problem,Their investigation did not fix an error on your report,"Submitted dispute about state tax liens on my credit report with Equifax on XXXX XXXX, 2017. The tax liens have been released as of XXXX XXXX, 2017. Equifax refuses to remove said liens from my credit report even after showing proof of liens being released.",,"EQUIFAX, INC.",OH,45371.0,Servicemember,Consent provided,Web,2017-08-10,Closed with explanation,Yes,,2626831,257,2098,2626831,1
142187,2021-06-23,Mortgage,Conventional home mortgage,Trouble during payment process,,"On the evening of XX/XX/21, I logged onto my online Wells Fargo portal and was shocked to see a late mortgage payment. To my knowledge, the account was on autopay from a linked Wells Fargo checking account, just as it has been since the inception of this mortgage. I immediately paid the past-due amount and re-initiated autopay in that moment. 

Subsequent communication with customer service resulted in a false accusation that I previously disabled autopay via the online portal. I did not this action and there is no written or digital verification of this action. I keep a very high cash balance in my Wells Fargo checking account and would have no reason to sabotage my own credit or banking relationship. I asked why Wells Fargo hadnt attempted to contact me directly before levying late fees and reporting the late payment to consumer credit bureaus. I was informed that the only attempts to contact me had been made via unidentified XXXX numbers who do not leave voicemails. I received no written communication via US mail as of that date, email, the secure Wells Fargo online message portal, text message, or voicemail. Yet, in the absence of any real communication, Wells Fargo found no issue finding time to impose late fees and report a late payment to consumer credit bureaus. 

After disputing the late payment reporting, Wells Fargo has refused to amend the credit reporting despite the fact that they are directly responsible for the late payment. They keep referring to any basic dialogue or customer service as "" a courtesy. '' Their actions feel shady at best, and are designed to work against the customer 's best interests.",Company has responded to the consumer and the CFPB and chooses not to provide a public response,WELLS FARGO & COMPANY,NY,10025.0,,Consent provided,Web,2021-06-23,Closed with explanation,Yes,,4486908,1645,685,4486908,1
543534,2017-05-31,"Credit reporting, credit repair services, or other personal consumer reports",Credit reporting,Incorrect information on your report,Personal information incorrect,"Applied for loan with  XXXX  and was denied due to the following reason : Unable to verify personal information or identity.   
The credit reporting agency is LexisNexis Risk Solution Bureau Consumer Inquiry D  epartment  XXXX .  XXXX   XXXX   XXXX , GA  XXXX  Toll free number  XXXX  I have never heard of this agency and can not get my report because they can not verify my identity. I do n't know where they get their information from but how do I get this corrected? I ca n't verify it is me according to them to fix the information that I am denied for. When I enter my ss to request report the recording tells me it is incorrect.",,LEXISNEXIS,TX,78250.0,,Consent provided,Web,2017-05-31,Closed with explanation,Yes,,2497629,635,2169,2497629,1
803229,2022-11-01,Credit card or prepaid card,General-purpose credit card or charge card,Struggling to pay your bill,Credit card company won't work with you while you're going through financial hardship,"During Covid-19 pandemic, I XXXX from XXXX in XX/XX/XXXX moved back home and worked at XXXX XXXX I was removed from my XXXX XXXX position on XX/XX/XXXX, and on XX/XX/XXXX, my father, unfortunately, had a XXXX XXXXXXXX and my mother and I were left to pick up the slack with the bills in the household, resulting in me not being able to pay off my required dues. With the lack of job offering during the pandemic, I was not able to fully sustain all of the bills that were given to me, specifically my XXXX loans and my credit card bills.",Company has responded to the consumer and the CFPB and chooses not to provide a public response,WELLS FARGO & COMPANY,TN,38125.0,,Consent provided,Web,2022-11-01,Closed with explanation,Yes,,6152362,537,189,6152362,1
981215,2021-02-12,Credit card or prepaid card,Government benefit card,Trouble using the card,Problem using the card to withdraw money from an ATM,"XX/XX/21 XXXX ATM withdrawl {$500.00} XX/XX/21 XXXX ATM withdrawl {$500.00} ( less than 24 hrs later, but different day ) XX/XX/21 XXXX ATM withdrawl {$500.00} XX/XX/21 ATM says I have reached my limit for the day, but I have not. 
XX/XX/21 XXXX ATM withdrawl {$500.00} XX/XX/21 XXXX ATM withdrawl {$500.00} XX/XX/21 XXXX TODAY- says I have reached my limit for the day, but I have not. 

So, I called the number on the back of the card, customer service rep says that you can only do one withdrawl in a 24 hr period. I mention my withdrawl history of XXXX to XXXX, less than 24 hours and no problems. They have no response. I said so I have to wait until after XXXX tonight to take my next advance then, as that would be 24hrs since my last withdrawl, they say no, I have to wait an additional 12 hours because I am penalized for trying to take my unemployment money out before the initial 24 hr period was up. I said you do realize that this is my money, my unemployment, I use to feed my family and pay my bills right? Unacceptable, i am ready to call local news station.",Company has responded to the consumer and the CFPB and chooses not to provide a public response,U.S. BANCORP,PA,18222.0,,Consent provided,Web,2021-02-13,Closed with explanation,Yes,,4137201,1074,816,4137201,1
512104,2021-05-07,"Credit reporting, credit repair services, or other personal consumer reports",Credit reporting,Problem with a credit reporting company's investigation into an existing problem,Their investigation did not fix an error on your report,"I have disputed the account with XXXX services on my credit report several times ( XXXX/XXXXXXXX, XX/XX/2020 ). I keep telling them it is a fraud, and have no business with that company. I do not know who they are. The information does not even match on the sites.This is hurting my score. 

I also contacted XXXX XXXX  and they stated I have never been delinquent because I have been on deferment. 
There are several old accounts I asked to be removed, and they have not been. 

Please help me!",Company has responded to the consumer and the CFPB and chooses not to provide a public response,Experian Information Solutions Inc.,NJ,7748.0,,Consent provided,Web,2021-05-07,Closed with explanation,Yes,,4358896,495,732,4358896;4358900;4358901,3
926856,2019-06-21,"Credit reporting, credit repair services, or other personal consumer reports",Credit reporting,Improper use of your report,Credit inquiries on your report that you don't recognize,"i have inaccurate and unauthorized credit application on my XXXX report : 1- XXXX on XXXX XXXX-XXXX  2- XXXX  onXX/XX/XXXX 3- XXXX  on XXXX XXXX-XXXX 4- XXXX on XXXXXX/XX/XXXX as well as on my experian report : 1- XXXX  on XXXX XXXX-XXXX 2- XXXX on XXXX   06-2019 3- XXXX on XXXX XXXX  4- XXXX XXXX XXXXXXXXXX/XX/XXXX 5- XXXX XXXX XXXX XXXX XXXX 6- XX/XX/XXXX i worked out with XXXX and i informed with the inaccurate inquiries i fixed my XXXX report,",Company has responded to the consumer and the CFPB and chooses not to provide a public response,Experian Information Solutions Inc.,MD,21221.0,,Consent provided,Web,2019-06-21,Closed with explanation,Yes,,3282747,451,1418,3282747,1
489084,2020-03-30,Credit card or prepaid card,Store credit card,"Other features, terms, or problems",Other problem,"On XX/XX/2020 I attempted to cancel my auto pay option online for my Macy 's credit card. The option to cancel was denied with the message that payment was in process. I then called the customer service number only to get an automated message that there were no agents available and directing my back to the store website. On XX/XX/XXXX, I again attempted to cancel the auto-pay option online with the same denial message given. 
My bank is unable to cancel the auto-pay as well. we have lost half our income due to the Covid-19 outbreak. Macy 's is only adding to the stress. Please help.",Company has responded to the consumer and the CFPB and chooses not to provide a public response,"CITIBANK, N.A.",CA,92651.0,,Consent provided,Web,2020-03-30,Closed with non-monetary relief,Yes,,3585604,589,1135,3585604,1
1092373,2019-03-26,Mortgage,Conventional home mortgage,Trouble during payment process,,XXXX XXXX first refinance and XX/XX/XXXX second refi by XXXX from XXXX Texas have caused me XXXX XXXX XXXX at the age of XXXX now by XXXX my deeds after they were notarized including but not limited to Grant deeds and trust deeds and they worked in concert with the banks and insurance companies. The notary XXXX XXXX confirmed this as well. I have all proof and certified stamped documents showing the fraud by all the attorneys involved down to the officer in control of currency that uncovered XXXX XXXX XXXX fraud and fraud upon the courts. There have been 2 Civil cases first was XXXX XXXX XXXX Civil case # XXXX and the second Civil case # XXXX where we had a XXXX dollar judgment in our favor that was awarded XX/XX/XXXX against XXXX XXXX XXXX   XXXX XXXX. Upon prevailing one of the attorneys got an unlawful stipulation to set aside for good cause and we lost the judgment. First lawsuit will show conflict of interest showing their attorney was handling the case which we had an attorney already and had no written concent or prior discussion with my son. Forensic report I have in possession will show Security fraud and lenders not paid ( investors wallstreet not paid ). There are more provacle forms of fraude done by the banks in concert with title and attorneys etc.,,Ocwen Financial Corporation,CA,93012,Older American,Consent provided,Web,2019-04-05,Closed with explanation,Yes,,3191478,1282,1505,3191478,1
396914,2018-09-17,"Money transfer, virtual currency, or money service",Domestic (US) money transfer,Fraud or scam,,"On XX/XX/2018 Santander Bank removed without notifying me {$3400.00}. Seems someone claimed that they sent funds into the wrong account. Seems to me that anyone can make a claim of doing this but can they show proof. Seems that the banks do not demand some proof of this. Thereby creating a back door for scamming and thief. 
i have gone into my hangouts account and have printed a portion of my conversation with XXXX XXXX showing that the funds were sent to the account specified and to me. I have added those pages to this complaint. One must remember that there is no way to print out a conversation or partial conversation for hangouts. One must copy and past to XXXX or a writing  software. 

The individual to call and confirm is XXXX XXXX her phone number is XXXX It is a XXXX number. Seems the funds were put into Ms. XXXX XXXX 's XXXX account.",Company has responded to the consumer and the CFPB and chooses not to provide a public response,"SANTANDER BANK, NATIONAL ASSOCIATION",NY,10009.0,Older American,Consent provided,Web,2018-09-19,Closed with explanation,Yes,,3020906,853,1695,3020906,1
898753,2020-10-19,"Credit reporting, credit repair services, or other personal consumer reports",Credit reporting,Improper use of your report,Credit inquiries on your report that you don't recognize,"XXXX  credit bureau is practicing Deceptive practices. I have provided three written requests to ask for six ( 6 ) different inquiries be removed from my credit report I DiD Not Authorize. XXXX CONTINUES TO REPORT THESE INQUIRES. I was affected by XXXX  data breach in XXXX as well as two other breaches. My credit file and personal information was compromised. I informed XXXX  as recently as XX/XX/XXXX to remove the following Inquiries. One company ran my file 3 times on the same day. I did not authorize this. Also XXXX  is lowering my score with each credit dispute. 
XXXX XXXX - Date of Inquiries : XX/XX/XXXX XXXX XXXX- Date of Inquiries : XX/XX/XXXX XX/XX/XXXX XXXX XXXX - Date of Inquiry : XX/XX/XXXX XXXX  XXXX - Date of Inquiry : XX/XX/XXXX XXXX XXXX XXXX - Date of Inquiry : XX/XX/XXXX XXXX XXXX - Date of Inquiry : XX/XX/XXXX",Company has responded to the consumer and the CFPB and chooses not to provide a public response,"TRANSUNION INTERMEDIATE HOLDINGS, INC.",TX,75056,Servicemember,Consent provided,Web,2020-10-19,Closed with explanation,Yes,,3906603,839,932,3906602;3906603;3906604,3
456047,2021-05-02,Debt collection,Other debt,Attempts to collect debt not owed,Debt is not yours,"On XX/XX/2021 I filed a complaint against XXXX XXXX who is trying to collect a debt he claims my sister owes him. The complaint number is XXXX. On XX/XX/2021 I received the resolution from Square who says it appears to be a phishing scam and Square would never ask for money. I responded that I did not think this fixed the issue. I have just now again received a demand for payment, from the same person, XXXX XXXX, this time through XXXXc, and again another one from the same company as before, XXXX at https : XXXX } XXXX. ( the symbol before the numbers "" 101 '' after "" XXXX  '' is strange one, a vertical squigly that my computer keyboard does not provide I don't believe the CFPB investigated the correct entity..it may not be the companies that are wrong, unless they accept any claim for payment coming through their site, it appears to be the man, XXXX XXXX, who is initiating the fraudulent claim. I previously provided his telephone number, XXXX area code. Can you please look at the original claim again, nothing has been fixed. I received the same message only 2 days after you believed it to be fixed.",,Square Inc,NJ,7930.0,Servicemember,Consent provided,Web,2021-07-02,Closed with explanation,Yes,,4343861,1116,737,4343861,1
1021850,2020-12-06,"Credit reporting, credit repair services, or other personal consumer reports",Credit reporting,Incorrect information on your report,Old information reappears or never goes away,"I have been out of school for 10 years and paid off my student loan balance in XX/XX/2020. All of my student loans have been serviced by Fedloan Servicing. All 3 credit agencies ( XXXX, XXXX, and XXXX  ) show over 40 student loan accounts ( some of them from my XXXX degree which were paid off over 15 years ago ) which adversely impact my credit score. I am trying to buy a home and this is negatively impacting me. Many of the "" accounts '' are loans with the same date. They won't fix this, and I submitted complaints with all 3 credit agencies. Their interface times out after 5 mins so it's impossible to go line by line to ask them to fix this issue. I have a XXXX balance and neither party thinks its their job to do anything. Fedloan Servicing, whom I called weeks ago, tells me to contact the credit agency, and the credit agencies tell me to contact the servicer to have the loan removed. Now I am stuck in the middle. This is outrageous.",,AES/PHEAA,CA,94131.0,,Consent provided,Web,2020-12-06,Closed with explanation,Yes,,3993894,948,884,3993894,1
