325619,2016-07-14,Bank account or service,Checking account,"Account opening, closing, or management",,"I signed up for a Citigold checking account from Citibank on XXXX/XXXX/16 because of the XXXX XXXX miles offer. I saved the terms of the offer for my own record. After I signed up for the account, I did not see the offer notated on my account. I emailed Citibank to make sure, and received a message from XXXX XXXX XXXX stating : "" I can confirm our promotion to earn the bonus XXXX XXXX miles is attached to your account ''. She then listed all the things I have to do to get the offer. 
On XXXX/XXXX/16, I messaged Citibank asking if I 've met all the requirements for the offer. On XXXX/XXXX/16, XXXX XXXX from Citibank emailed me back, however the language was unclear. She repeated the requirements ( {$1000.00} debit card purchases and XXXX qualifying bill payment ), and stated that "" After reviewing your account, I see you processed XXXX transaction for {$1000.00} and a bill payment for two consecutive months. Please review the terms and Conditions listed on the offer sent for qualification. Please note, all promotions will differ and are targeted to specific account holders during specific time frames ; so if you did not receive this promotion via your Citi credit card statement, personal email, or through U.S mail to your home address you will not qualify for this promotion. We regret if this causes you any inconvenience. '' I was not entirely sure what this all meant. I feel like she listed the things that I 've done but never confirmed that I 've met all the requirements and when my points will post. I was confused so on XXXX/XXXX/16, I chatted with representative XXXX via live chat. I asked her the same question ( if I 've met all the requirements for the offer ), and she confirmed that I "" have met the offer requirements '' and "" please allow until XXXX/XXXX/16 for the miles to be credited ''. I thought that was a really long wait, but decided to be patient and wait it out. 
On XXXX/XXXX/16, I messaged Citibank again asking the status of my offer, since it has been 5 months since I signed up for the account and I still have n't received the miles yet. XXXX XXXX responded and stated "" On my last message dated on XXXX/XXXX/2016, I advised of the requirements, confirm you completed them, explained the monthly service fees and advised the following : Please note, all promotions will differ and are targeted to specific account holders during specific time frames ; so if you did not receive this promotion via your Citi credit card statement, personal email, or through U.S mail to your home address you will not qualify for this promotion. We regret if this causes you any inconvenience. 
With that being said I regret to advise the bonus can not be honored, your understanding and patience regarding this matter is highly appreciated. '' I am very unhappy that I am now told that Citibank wo n't honor the bonus. I 've had this account open for 5 months, during which I was told twice that the offer was attached to my account and that my miles will post by a specific date ( XXXX/XXXX/16 ). How can they just tell me now, after 5 months, that they wo n't honor the bonus, and only after I reached out to them first? I feel like this is deceptive marketing on their part ( promising a bonus that never posted ) to keep me to continue using their checking account and debit card.",Company has responded to the consumer and the CFPB and chooses not to provide a public response,"CITIBANK, N.A.",NV,89122.0,,Consent provided,Web,2016-07-14,Closed with monetary relief,Yes,No,2013205,3320,2490,2013205,1
929799,2018-04-08,Mortgage,Home equity loan or line of credit (HELOC),Struggling to pay mortgage,,"I applied for mortgage assistance in XX/XX/XXXX with Chase. I am now in the 9th month with no resolution. I have answered the same questions over and over. I have sent all requested paperwork in duplicate and triplicate. I have spoken with them weekly to resolve any issues. 

When I called to check on my loan status in XX/XX/XXXX, I was informed that I had already called in on XX/XX/XXXX to cancel all activity on my loan and that I was no longer interested in a loan modification. I did not talk with anyone at Chase at all on that date. Since all calls are recorded, I have requested to hear the recording of this call. My case was closed. After escalation of my complaint and transfer to another department, the account was supposedly reopened, however all documentation would need to be resent. So we effectively started from the beginning. 

Chase can not be this accidently inefficient. My application is clearly being treated in a delaying and fraudulent manner. Each time I call I speak with a different representative. I have been assigned at least 4 Relationship Managers ( Ive spoken with one ). I received 2 copies of my appraisal in XX/XX/XXXX one day apart, and another copy in XX/XX/XXXX. Letters are erratic, stating that information is complete and then it is not.

In summary, I have been shuffled around from department to department, talked to multiple people making duplicative requests, sent and resent income documentation multiple times, been driven into default due to inability to finalize refinance request, been told that my refinance request was closed, claiming I called and requested they do so, been denied recording evidence of my call that the refinance request be closed, been offered reinstatement of the refinance request ( in XX/XX/XXXX ) with a non-committal expectation to have a final response on approval within the next 30-45 days ( the same time frame provided at the time I opened my initial request 9 months ago ), been offered no further apology or admission of fault. 

I would not be in this position at all if I had not been advised by Chase back in XX/XX/XXXX that a home equity loan would be better for me than my requested conventional mortgage. ( It would then not be qualified for the automatic loan modifications that followed the XX/XX/XXXX recession. ) Recent Chase advice specified that if I did not qualify for modification under this current application, I would need to be at least 4 months in arrears before looking at other options. Since the loan process would be completed within a 45 day period ( per Chase ), I stopped making payments on the property to cover this possibility. Now 270 days later, my credit score has dropped and affected my relationships with other financial institutions. 

The treatment I have received from Chase has had a huge negative impact on my life. I need this situation resolved.",,JPMORGAN CHASE & CO.,SC,29576.0,,Consent provided,Web,2018-04-08,Closed with explanation,Yes,,2868260,2879,1857,2868260,1
72066,2021-06-28,"Money transfer, virtual currency, or money service",Virtual currency,Fraud or scam,,someone has my information and they are able to misuse it.,Company has responded to the consumer and the CFPB and chooses not to provide a public response,"BANK OF AMERICA, NATIONAL ASSOCIATION",AZ,85396,,Consent provided,Web,2021-06-28,Closed with explanation,No,,4499104,58,680,4499104,1
532687,2017-07-28,"Money transfer, virtual currency, or money service",Virtual currency,Other service problem,,"I use an app called XXXX and the app is great ... lets me borrow money and send the money into my account within seconds. The problem is TD BANK, they take forever to send XXXX my updated account balance, causing me to wait long for money. When they do update it a lot of times it 's wrong. Like it will say I have "" XXXX dollars in my account. My balance has n't been {$30.00} for about 4 days now ... ...",,TD BANK US HOLDING COMPANY,PA,19154.0,,Consent provided,Web,2017-07-28,Closed with explanation,Yes,,2588761,406,2111,2588761,1
432127,2022-08-05,"Credit reporting, credit repair services, or other personal consumer reports",Credit reporting,Problem with a credit reporting company's investigation into an existing problem,Investigation took more than 30 days,I have submitted disputes to you and I didnt get a response within 30 days and you are required by law to do so. Please investigate my disputes. Thank you in advance.,,"EQUIFAX, INC.",CA,90241.0,,Consent provided,Web,2022-08-05,Closed with explanation,Yes,,5846624,166,277,5846624,1
776960,2019-07-03,Mortgage,FHA mortgage,Struggling to pay mortgage,,"1. XX/XX/XXXX the company I was working with Sold and downsize, my department was the 3rd tier of lay offs and I struggled for employment. The mortgage company at the time was Greentree Services, I applied and approved for a loan modification program 2. I set up direct payments from my bank to GTS to ensure timely monthly payments. 
3. Early XX/XX/XXXX GTS called stating the XX/XX/XXXXpayment had not been received and asked for the XX/XX/XXXX mortgage payment over the phone ( which I gave them ) I paid my bank {$30.00} stop payment fee on the 1st payment. I have bank documentation ( attached ) proving GTS DID receive payment in October but GTS DID NOT post until XX/XX/XXXX. I was told "" don't worry about it '' 4. XX/XX/XXXX Payment was issued from my bank and Submitted on time 5. GTS returned the XX/XX/XXXX mortgage payment bank check back to me, stating I was rejected from the program due to none payment in XX/XX/XXXX. 
6. Communications with GTS During the next year and a half ( XX/XX/XXXX -XX/XX/XXXX ) GTS told me to mail and fax all bank records, documents, statements, tax records, loan modification packets providing the proof of XX/XX/XXXXpayment. ( documents attached ) 7. I faxed and mailed GTS 10-15X at {$2.00} a page, Mailing documents @ {$1.00} per envelop to NO AVAIL 8. XX/XX/XXXX ( NOW DITECH ) I found foreclosure papers nailed to my front door and now I am in fear of loosing my home, being homeless and financially ruined. Acquiring charges daily since XX/XX/XXXX in addition to compounding fees, charges, late and annual fees, lawyers fees totaling and adding up to {$45000.00} to my mortgage balance. 
9. I was drained mentally and financially ruined because of GTS/DITECH The XXXX XXXX and XXXX   during this time frame was so unbearable I am still haunted and XXXX when I think about the situation today and panic at the thought of reliving it. 
10. I had NO recourse, no one would listen, no one cared, no one provided advice. I felt as though there was no other choice but to file bankruptcy, which did XX/XX/XXXX. 
11. Now 3 years later -XX/XX/XXXX Ditech sends me a loan modification packet low monthly mortgage payment ( roughly {$850.00} ) I was was advised by legal aid ( bankruptcy and legal assistance for low income ) 12. Take  the deal NOW and run. LA told me I could NOT negotiate the {$45000.00} in fees added to the mortgage balance. Keep in mind I bought this house for $ XXXX in XX/XX/XXXX( XXXX yrs ago ) My pay off balance NOW is {$190000.00} ( whats wrong with this picture? ) 13. Fast forward to XX/XX/XXXX. DITECH/GTS and whatever other names they operated under. have now filed Bankruptcy. They will wipe away all debts, restructure, reorganize, and properly walk away with millions if not billions of dollars "" smelling Like a rose '' operating under the same code of ethics destroying consumers once again. How is this Fair or Ethical????? 
14. Nevertheless, in XX/XX/XXXX I was given the opportunity to file a "" proof of claim '', which did as a debtor of DITECH ( documents attached ) 15. I am so far down of the list of debtors My fear is I will NEVER receive a dime, or retribution for the damages DITECH imposed and continues to impose on me still to this date. 
16. I am current on my payments yet the last statement I received was ( 6-7 months ago ) XX/XX/XXXX from DITECH-Reflected I was behind {$2500.00} behind on payments ( NOT TRUE ) 17. Being harassed again! letters are posted to my door DITECH people drive by taking photos of my property ( I asked the last person taking photos what they were doing, why and for whom- DITECH ) 17. I received a DITECH loan assistance packet in XX/XX/XXXX which I submitted in XX/XX/XXXX. I HAVE NEVER RECEIVED A RESPONSE FROM DITECH - calls made to no avail ( unethical ) 18. The XXXX XXXX is unbearable, I am XXXX and reliving the fear of losing everything all over again. Fear of repetition of not being heard, not having a leg to stand on, losing my dignity again. I am suffering the consequence of an incompetent and unethical company DITECH! WHY HAS THIS BEEN ALOWED TO HAPPEN for so long AND WHY / HOW CAN THEY CONTINUE TO GET AWAY WITH IT!! 
19. DITECH documents false records and statements without any consequences, this is against the law Please HELP ME TO STOP THIS",Company believes the complaint is the result of a misunderstanding,Ditech Financial LLC,DE,19809.0,,Consent provided,Web,2019-07-03,Closed with explanation,Yes,,3295058,4288,1406,3295058,1
721972,2022-12-13,"Money transfer, virtual currency, or money service",Virtual currency,Fraud or scam,,"In mid XX/XX/XXXX, I saw a message in XXXX ( an online chat platform ) to me in a group chat called XXXX XXXX XXXXXXXX XXXX. 
I read messages from a variety of members and it seemed to me that they are all happy making money. The group was apparently a collection of investors following trading direction from someone named XXXX XXXX ( aka. XXXX XXXX XXXX- XXXX. XXXX XXXX XXXXXXXX XXXX XXXX and It seemed legit. 

On XX/XX/XXXX I asked the group how to become a member. Someone who is the head of the group answered me back. Her name is XXXX XXXX last name unknown ). She told me there is no Membership fee. There is a XXXX XXXX commission from any profits made. So I said, I will try with $ XXXX. XXXX showed me how to open an account with XXXX an online trading platform. This involved registering at XXXX XXXX XXXX XXXX XXXX with an invitation code XXXX. Then she showed me how to transfer money from my XXXX Account to XXXX. We boughtTether XXXX XXXX worth {$10000.00}. I sent XXXX XXXX to this address. 
XXXX I started trading with XXXX XXXX. The first transaction I made was almost XXXX. I told her that it was easy. She said, but of course in every investment there is a risk. I was convinced to put more money into my account. She said that the following week is the big Layout meaning we can make more money. The more money in your account the more money you can make, XXXX XXXX XXXX helped me again to buy XXXX XXXX from my XXXX account. Bought {$98000.00} XXXX for {$100000.00} XXXX sent XXXX XXXX to XXXX Bought {$98000.00} XXXX for {$100000.00} XXXX sent XXXX XXXX to XXXX On XX/XX/XXXX. I bought XXXX XXXX XXXX for {$2800.00} from XXXX. 
I sent XXXX USDT to XXXX On XXXX XXXX I used my BINANCE I bought XXXX {$5200.00} XXXX sent XXXX XXXX to XXXX I also used my XXXX account, bought XXXX for {$10000.00} and I sent XXXX XXXX to XXXX My total loss of {$220000.00} ( that is not including the fake profit from their platform ) The website for the platform can be found at XXXX XXXX XXXX  ) Or XXXX Last Friday XXXX XXXX was our last trading day. XXXX texted the investment group through XXXX, XXXX XXXX XXXX XXXX XXXX, You can withdraw all the funds in your account including the profit to your bank card, and then settle the club commission with me. 
My understanding was that we can withdraw all the funds in the account including the profit and then settle the club commission with her. 
So she helped me initiate a transfer of {$490000.00} ( which included my initial investment plus gain. ) from their platform XXXX or XXXX account to my XXXX account. Using XXXX  XXXX address : XXXX I was waiting for the money to arrive in XXXX, minutes later I texted her that the money was not in XXXX yet and it was taking too long. 
XXXX told me that I have to pay the commission of {$53000.00} to her first before they can release the money despite the fact she described this account as my account. I told her I dont have additional funds in my bank and that I was planning on paying the commission from the earnings. She told me, That was the agreement that I pay the {$53000.00} before they can release my money to XXXX. We had many text conversations that evening of Friday XX/XX/XXXX, the whole day Saturday XX/XX/XXXX and now Sunday XX/XX/XXXX. I requested that they release the XXXX to XXXX to settle the commission on Saturday XX/XX/XXXX. XXXX responded on XX/XX/XXXX that my request was denied and the rules should not be broken. Anyone withdrawing funds is required to settle the commision first. 

I told her I have a friend who is willing to help me pay my commision. XXXX had texted me before that she is from New York. 
I told her that my friend lives in New Jersey and works in XXXX. She is willing to give you a cashier check and you release my money and I will be able to pay her back. She wants your address and telephone number and she can meet you tomorrow or Tuesday. XXXX did not agree. 

So, at this point they are holding my funds, requiring a commission payment be made through a cryptocurrency address. 
I believe that they have no intention in returning my money. 



I would like XXXX XXXX XXXX to refund my XXXX for defraudent me and wrong business practice. How can he be allowed to practice this false XXXX firm. 
As seen in XXXX : XXXX XXXX XXXX XXXX is the founder of "" XXXX XXXX XXXX XXXX XXXX '' worldwide. 
His advocacy by forming the club is to share his knowledge and skills to all of the traders globally. 

He is a member of both the XXXX XXXX XXXX XXXX University XXXX XXXX XXXX XXXX XXXX University. 
Born in an ancient family in XXXX, XXXX in XXXX. 
He studied at the XXXX XXXX University XXXX XXXX in XXXX and then eventually entered the Department XXXX XXXX XXXX XXXX XXXX XXXX XXXX in XXXX and obtained a XXXX XXXX XXXX. 
In XXXX, he joined the XXXX XXXX Bank as an intern as economic observer assistant. He began to work as an economic analyst in the XXXX XXXX Bank in XXXX, and start to participate in the foreign exchange reserve fund in XXXX. 
In XXXX, he participated in the management of foreign exchange reserve hedge funds that exceeded XXXX XXXX XXXX dollars. 

XXXX XXXX In his trading he found that XXXX XXXX and hedge funds were controlled by politicians and capital, and that the probability of profit could be greatly increased by having a strong enough capital to trade in the same direction at the same time, so XXXX  became a tool for capitalists to harvest their profits, and he abhorred these actions. 
So more and more he yearned for the absolute freedom of the trading market, so with the help of his previously accumulated contacts, after a lot of understanding and testing research After a lot of research and testing, he used his contacts and experience to lead a group of his followers and traded like a fish out of water, increasing his capital like a snowball by a hundredfold in just XXXX year 's time. Since then, he has risen to fame in the foreign exchange market and has countless followers. 
In order to promote the globalization of investment in the foreign exchange market, after resigning from the XXXX XXXX XXXX, he started to prepare his own brokerage company and led investors to promote the popularization of foreign exchange investment together, set up a club for foreign exchange investors to exchange information and do basic general knowledge, professional knowledge training and trading skills training for beginners from time to time. 
Through the information and signals he shares in the club, more and more people have grown to become gooXXXX XXXX XXXX with profits of at least XXXX XXXX in each special club training session, and club members have gained considerable wealth as a result of investing and trading XXXX XXXX with him. Contact Info XXXX, XXXX XXXX  XXXX XXXX XXXX My XXXX XXXX is using this fraudulent platform : As seen in XXXX : Is XXXX Legit? 
website XXXX XXXX website IXXXX XXXX *Is this the right industry? website XXXX XXXX *Is this the right Sector? 
Is XXXX legit? Nope. It has the lowest trust rating on our chart. Let 's take a look at it and its XXXX industry. We put to work XXXX powerful factors to expose high-risk activity and see if XXXX is a scam. In this article, we have a review, take a look at alternative legitimate products/services and show you what you can do if you already lost your money. 

XXXX XXXX XXXX algorithm gives this business the following rank : XXXX You should know why XXXX is flagged - see below. 

Why would XXXX allow this XXXX XXXX firm be exposed to the world. 
XXXX is also responsible for all the scams happening in the world. They should have a strict policies and have a specialize scam dectectors to stop this XXXX XXXX. XXXX has spam dectectors why can't XXXX do the same.",,BAM Management US Holdings Inc.,CO,80134.0,Older American,Consent provided,Web,2022-12-13,Closed with explanation,Yes,,6317308,7741,147,6317308,1
1090767,2021-07-26,"Credit reporting, credit repair services, or other personal consumer reports",Credit reporting,Problem with a credit reporting company's investigation into an existing problem,Difficulty submitting a dispute or getting information about a dispute over the phone,This complaint is regarding Complaint XXXX Experian responded stating that I needed to state exactly what the inaccuracies were and personal information. I have previously sent all this information by mail and no luck in them responding to my disputes. Under Complaint XXXX all the documentation was attached that was previously sent via usps mail at this point this is clearly a stall tactic and I will have to take further if this is not corrected after this complaint to FTC I have kept all documentation I have sent them over and over my disputes of my concerns and they are the ONLY BUREAU refusing to honor my request as a consumer. At this point you have past the timeframe and I know that they have received all my mail due to nothing coming back to my address showing return to sender. I am now demanding removal or please be prepared to issue payment to me due to filing a civil lawsuit with my consumer attorney for them violating my rights this is ridiculous at this point.,Company has responded to the consumer and the CFPB and chooses not to provide a public response,Experian Information Solutions Inc.,MO,63136,,Consent provided,Web,2021-07-26,Closed with explanation,Yes,,4576194,985,652,4576194,1
776544,2019-08-14,"Credit reporting, credit repair services, or other personal consumer reports",Credit reporting,Improper use of your report,Reporting company used your report improperly,factual data has done hard inquires on my credit report. I have contacted them they have no response. https : //www.factualdata.com/index.html.,,FACTUAL DATA CORP.,CA,94582.0,,Consent provided,Web,2019-08-14,Closed with explanation,Yes,,3340041,143,1364,3340041,1
928103,2019-06-17,Debt collection,I do not know,Written notification about debt,Didn't receive notice of right to dispute,"I have no idea who MERCHANTS ADJUSTMENT is or who they represent. This company entered a collection on my credit report without notifying me or contacting me regarding what this debt was about. I have never had an account with this company or anyone they claim to represent. MERCHANTS ADJUSTMENT is indicating that an account with an unknown account number was opened with their company in XX/XX/2016. I never opened an account with them or anybody else. This account must be a result of identity theft or someone opening an account in my name using my identity. I have no knowledge of this account nor did I give anyone permission to open an account with my name. 

When a debt collector engages in the collection of DEBT they must provide copies of the following items : 1. Provide a certified copy of the complete credit application that debtor signed to secure the credit with your entity. 

2. Provide signed verification of each transaction that is part of the alleged cumulative debt. 

3. Provide the contract or other instrument through which [ Alleged Creditor } authorized MERCHANTS ADJUSTMENT as third-party collection agent. 

4. Provide a true and correct copy of the instrument by which [ MERCHANTS ADJUSTMENT } was authorized as a mixed-ownership government corporation with authority to hypothecate credit of the United States ( 31 U.S.C. 9101 ). 

5. Provide the delegation of authority from the Director of the Office of Management Budget to MERCHANTS ADJUSTMENT, that authorizes your company to settle accounts of the United States ( Public Law 104-316 ). 

6. Provide the Certified Assessment Certificate. 


Violation ( s ) : * Failure to provide a notice prior to reporting negative information to a credit reporting agency ( CRA ). 
* Failure to provide a notice within 30 days after reporting negative information to a credit reporting agency ( CRA ). 
* Failure to provide an Opt Out Notice. 
* Failure to disclose as required by federal law mandatory information in their Privacy Policy notice. 
* Sharing Non Public Information ( NPI ) without providing an Opt Out Notice",,"MERCHANTS ADJUSTMENT SERVICE, INC.",LA,70065.0,,Consent provided,Web,2019-06-17,Closed with explanation,Yes,,3277225,2099,1422,3277225,1
