991438,2021-02-17,Credit card or prepaid card,General-purpose credit card or charge card,Closing your account,Company closed your account,"I have been an American Express card member since XXXX  - My card was cancelled recently and their explanation was review of credit report. They did not take my payment history nor usage into consideration - just my score. With the pandemic, shopping has been limited, but that did not matter. i have used my card 3 times so far, to shop online, but that did not weigh with them either. 
i am horrified that they cancelled my good standing account for with this as reason. since i have never made late payments nor had any problem with my account. Credit scores dip and soar ... they fluctuate, but Amex does not care. I am truly horrified at this treatment after all the years I was a loyal good standing customer.",,AMERICAN EXPRESS COMPANY,NY,11228.0,Older American,Consent provided,Web,2021-02-17,Closed with explanation,Yes,,4147062,715,811,4147062,1
168110,2018-06-06,Debt collection,Other debt,Attempts to collect debt not owed,Debt was paid,"Stern & Stern is requesting payment of XXXX for a bill that was paid, perhaps even several times over the years to XXXX XXXX XXXX to lower our property taxes. He has since placed a lien on our property and according to county clerks office this bill dates back to XX/XX/2002. We have repeatedly asked Stern and Stern evidence of this bill to see if it is indeed the one that dates backs years ago to which they have never responded even though one of our requests was made via certified mail with signed returned receipt. We have the signed returned receipt but still have not received any bill, invoice or any proof of dept from them. We can not continue paying them for a bill we do not owe this has been going on for years. 

About one year later of our sending out the certified mail, I was notified by Stern & Stern that there was a judgement again my property and a lien on my house. I thought it was a scam, it took me weeks of working with my local town government to confirm that their is indeed a lien on our property. I believe that they may be targeting senior citizens because I recently found another complaint on XXXX reviews for the same law firm representing the same tax company describing Stern and Stern 's use of unscrupulous tactics. 

I asked my bank if it would be possible to return that far back in my banking history and they informed me that NY state has 6 year statue of limitations on collecting dept so that it should not be necessary for me to go through this trouble. I do not understand how they could legally place a lien on our property for a dept that exceeds the state 's statue of limitations. 

I do not want pay this company again and have them come back in a year or two and ask for payment once again. I do not want anyone to have to go through the time aggravation and stress I am going through trying to solve this. I do not want my assets frozen as he did to the gentlemen 's father ( XXXX XXXX ) on the XXXX review which I copy and pasted below. 

This seems like fraud to me and I would like a criminal investigation opened so that they can not target anyone else. 

Thank you for attention you can bring to this issue XXXX XXXX XXXXXXXX XXXX XXXX XXXX XXXX   XXXX,,, XXXX XXXX : "" These guys went after my father on a claim that he owed money to a property tax reduction company, I happen to have the same name as my father so they froze my bank account! They couldn't even ensure they had the correct social security number, and froze my assets illegally. When I asked them to pay the bank fee I was charged to get my bank account reinstated ( a couple of hundred dollars ) they refused. Now this event is coming back to haunt me again because this event made it onto my credit report. I called them to get it worked out and they gave me an attitude on the phone and were not sympathetic. ''",,Stern & Stern. P.C.,NY,11510.0,,Consent provided,Web,2018-06-07,Closed with explanation,Yes,,2928589,2841,1798,2928589,1
457319,2022-07-26,"Credit reporting, credit repair services, or other personal consumer reports",Credit reporting,Improper use of your report,Reporting company used your report improperly,"I sent written request on XX/XX/2022 asking EXPERIAN to do verification on my credit report and they did, EXPERIAN stated everything was accurate and I did a thorough research myself and found improper inaccuracies on credit report even after EXPERIAN did the thorough research. 

In accordance with the Fair Credit Reporting act EXPERIAN has violated my rights. 

15U.S.C 1681 section 602 A States have the right to privacy.

15U.S.C 1681 Section 604 A Section 2 : It also states a consumer reporting agency can not furnish a account without my written instructions. 

Multiple improper inaccuracies found on the following account XXXX Account # XXXX.",Company has responded to the consumer and the CFPB and chooses not to provide a public response,Experian Information Solutions Inc.,NY,11691.0,,Consent provided,Web,2022-07-26,Closed with explanation,Yes,,5812282,652,287,5812282,1
384350,2019-07-27,Mortgage,Conventional home mortgage,Struggling to pay mortgage,,I was two months behind I was paying so that I didn't hit the third month I was not able to make my payment for XXXX I was never notified loan services change we got in contact with phh mortgage they've specified a letter will be used out yo notified us they offer us an application for modification 3 weeks later they specified to me on a phone call I maid to the to see what was going on to find out I didn't qualified now I am on 6month default on payment they told me my manager will contact me till this day no phone calls from him at all,Company believes it acted appropriately as authorized by contract or law,Ocwen Financial Corporation,CA,90022.0,,Consent provided,Web,2019-07-27,Closed with explanation,Yes,,3320329,543,1382,3320329,1
1193063,2022-03-05,Checking or savings account,Checking account,Problem with a lender or other company charging your account,Transaction was not authorized,"explain I am a XXXX recent high school graduate who has been saving up to go to college and buy a car since those expenses are not currently available to me. My life saving of so far {$14000.00} has been taken from me by a hacker or thief through Wells Fargo and XXXX. I have run into an enormous amount of customer service challenges in the processing of my claim. 
On XX/XX/XXXX I turned my personal debit card off in my possession in hopes to save up and only spend the cash I had at hand. The very next day my account was hacked and someone who's name and contact information are listed in an email later sent by Wells Fargo stating this person has added themselves to my account as a deposit recipient through XXXX. I believe the same person then turned my card back on, changed my username and password, and lastly upped my spending limit per day. From there the below will explain the chain of events after. 
A transaction was made using a card created by someone at an ATM near my home XX/XX/22 The card was then taken to a XXXX in XXXX Ga, an hour, and a half from my home where someone inserted my card 4 times in a row withdrawing {$1000.00} cash back at a time. I was not notified once of those transaction. XX/XX/22 on XX/XX/22 the card was taken to a XXXX in XXXX Ga, 15 mins from the day before, and 5 transactions were made there. Again 5 transaction of {$1000.00} cash back at a time. Still no red flags reported to me. 
Random charges spanned on for 2 weeks, including charges up to {$500.00} at grocery stores and 2-day hotel rentals. 
3 checks were also mailed to me which is when I looked into my account and emails to find my account in disarray. These checks were fraudulent checks sent by Wells Fargo, that had been attempted to be deposited into my account. Check amounts totaling over {$27000.00}. ( Please reminder I am a 20 year who has no way of receiving a {$8000.00} check from a private investigator from NY. ) Once I was aware of my account being drained, I contacted Wells fargo and filed a claim. I was advised by 3 different employees of Wells Fargo that I would not need a police report and I would receive assistance. After roughly a week I called requesting an update on my claim and was told I would have to leave a number and the High value department would call me back within 10 days. I did not accept that and was then sent to a gentleman who told me I owed them the over drafted amount and Wells Fargo no longer wanted to do business with me. And advised if I didn't agree with him, I should file a claim. I informed him I had already done that. He them decided to ready my account notes and said, direct quote "" oh then wait tell they tell you in the mail. '' then hung up. I called back with someone informing me someone would call me back in 1 to 2 business days. 
The next day I called back and was informed my claim was denied with absolutely no explanation. I was told to wait for a letter. Three letters came with 2 different claim numbers and amounts with the explanation of a physical card was used so it could not have been fraud. There is apparently no further process to investigate if the decision was wrong. I called Wells Fargo and was told my claim could not be re-opened or helped and I could not be further helped. After a manager was requested, I was sarcastically and condescendingly told by XXXX, there is nothing else the bank will do. I explained I now had police reports, Ic3 reports, consumer fraud reports and identity theft reports which I was rudely told to email, and the fraud department may look at them. I was informed it probably wouldn't help though, by a Wells Fargo claims manager.",Company has responded to the consumer and the CFPB and chooses not to provide a public response,WELLS FARGO & COMPANY,GA,30127.0,,Consent provided,Web,2022-03-21,Closed with explanation,Yes,,5290375,3662,430,5290375,1
19500,2022-09-17,"Credit reporting, credit repair services, or other personal consumer reports",Credit reporting,Problem with a credit reporting company's investigation into an existing problem,Their investigation did not fix an error on your report,"Despite multiple written requests, the unverified accounts listed below continue to report on my credit report in violation of federal law. The last letter I sent to the XXXX credit bureaus was dated XX/XX/22 but I never received a response from them. These accounts must be validated in accordance with Sections 609 ( a ) ( 1 ) ( A ) and 611 ( a ) ( 1 ) ( A ). If the credit bureaus do not validate these accounts, I will take legal action against them. Please follow the law so that this matter can be resolved as soon as possible. 

XXXX XXXX XXXX XXXX XXXX : {$14000.00} ; XXXX XXXX XXXX XXXX XXXX Balance : {$240.00} ; XXXX XXXX XXXX Balance : {$390.00}",,"EQUIFAX, INC.",IL,60901.0,,Consent provided,Web,2022-09-17,Closed with explanation,Yes,,5988744,658,234,5988704;5988709;5988744,3
1065939,2018-08-22,"Credit reporting, credit repair services, or other personal consumer reports",Credit reporting,Incorrect information on your report,Information belongs to someone else,"It has been over 120 days, since XX/XX/2018, where I have sent in my first round of dispute letters by certified mail ( i.d . theft affidavit and police report ) for the credit bureaus to remove the fraudulent information from my credit report in violation of 15 U.S.C. 1681. 
This is my second time disputing these fraudulent accounts by certified mail ( affidavit of truth and facts ), since XX/XX/2018, on contacting the bureaus, and since then, I still havent had any results on the fraudulent information being deleted from my report. The credir bureaus are required under the FCRA to have properly verified that an account listed on my credit report is mine by having a copy of the original application. 
On XX/XX/2018 I certified mailed a second written request for the bureaus to remove the still remainding fraudulent accounts that are on my report. The bureaus have not provided me with a copy of the original documentation that they have on file. Under 609 and 611 ( a ) ( 1 ) ( A ) of the FCRA, the credit bureaus are required to promptly delete  all information which can not be verified. 
Under section 617, the law is very clear as to the civil liability and the remedy available to me for "" negligent noncompliance '' These bureaus have had over 120 days to complete these actions.",Company has responded to the consumer and the CFPB and chooses not to provide a public response,"TRANSUNION INTERMEDIATE HOLDINGS, INC.",TN,38016.0,,Consent provided,Web,2018-08-22,Closed with explanation,Yes,,2999085,1297,1721,2999085,1
144865,2021-12-03,Credit card or prepaid card,General-purpose credit card or charge card,Problem when making payments,Problem during payment process,"XXXX - I called to inform Discover that there are new pending unauthorized charges XXXX - I was denied the right to pay the balance in full, Discover representatives say they can't take a payment due to the fraud activity If I don't pay the balance in full on XXXX XXXX will report my current balance to the reporting agencies and my XXXX will be negatively affected, I do not carry balances past the 30 day cycle periods which, for XXXX, occur the XXXX day of each month.",,DISCOVER BANK,NY,11226.0,Servicemember,Consent provided,Web,2021-12-03,Closed with non-monetary relief,Yes,,4974694,472,522,4974694,1
1245913,2017-09-01,Checking or savings account,Checking account,Managing an account,Cashing a check,"A fraudster went into two different branches, one in XXXX IL and one in XXXX  and withdrew out {$2500.00} from my account and then {$3500.00} from my account at a physical location on XX/XX/XXXX.  I realized the {$6000.00} was taken from my account and filed a claim with Chase on Saturday the XX/XX/XXXX. I understand the 30 days it may take to rectify but provisional credit should be provided and wont be. When speaking to the personal banker in a branch location in XXXX on XX/XX/XXXX, I spoke to XXXX XXXX, he said Provisional credit would be provided within 1-3 days. I called today XX/XX/XXXX and was told no provisional credit will or can be given, even though my claim has been approved but its still under review. How can it be approved without a review? This has caused me a significant financial harm as I have a mortgage, and other bills to pay for along with taking care of my family. Chase does n't care about this situation this put me in as it basically cleaned my account out. This was solely an issue with Chase as they allowed two fraudulent transactions occur at their branch. My wife had her wallet stolen with her ID in it ( no account numbers were in there ) back on XX/XX/XXXX. We called Chase and informed them of the theft, yet no notes were placed of the theft on their teller profile. The fraudsters could n't have had the account number and would have needed to be provided by the teller when the fraudster went into the branch/drive thru. I called today ( XX/XX/XXXX ) and was told by an escalated claim rep- XXXX XXXX  around XXXX XXXX CST ) that provisional credit can not be given in this circumstance and I would have to wait up to the 30 days even though the level of financial harm this has put on me.",,JPMORGAN CHASE & CO.,IL,61761,,Consent provided,Web,2017-09-01,Closed with monetary relief,Yes,,2656414,1738,2076,2656414,1
243187,2022-07-14,"Credit reporting, credit repair services, or other personal consumer reports",Credit reporting,Problem with a credit reporting company's investigation into an existing problem,Their investigation did not fix an error on your report,"When I reviewed my credit report, I discovered that some of the information was erroneous. The 3 credit bureaus must validate this account in line with Sections 609 ( a ) ( 1 ) ( A ) and 611 ( a ) ( 1 ) ( A ). It is not authorized to fail to validate these reporting account as unverified information without providing any proof within the period allowed by law. This account need to investigate and delete from erroneous reporting in my file are listed on my credit report : XXXX XXXX XXXX",Company has responded to the consumer and the CFPB and chooses not to provide a public response,"TRANSUNION INTERMEDIATE HOLDINGS, INC.",FL,33065.0,,Consent provided,Web,2022-07-14,Closed with non-monetary relief,Yes,,5773129,490,299,5772759;5773075;5773076;5773120;5773129;5773133;5773135;5773139;5773604,9
538031,2019-09-07,"Credit reporting, credit repair services, or other personal consumer reports",Credit reporting,Incorrect information on your report,Information is missing that should be on the report,"On XX/XX/XXXX I used XXXX to pull all three of my credit reports. I noticed that my credit card was mistakenly marked as closed around XX/XX/XXXX on my reports. 

The credit card is a Visa XXXX XXXX XXXX XXXX XXXX XXXX that was originally issued around XXXX. 

I have been using my card continuously both before XX/XX/XXXX and to the present ( most recently the morning of XX/XX/XXXX ) so I know that the card is not cancelled, and I have been making payments on time.",,"EQUIFAX, INC.",CA,95661.0,,Consent provided,Web,2019-09-07,Closed with non-monetary relief,Yes,,3366971,468,1340,3366971;3366972,2
365798,2018-07-18,"Credit reporting, credit repair services, or other personal consumer reports",Credit reporting,Incorrect information on your report,Account information incorrect,"Hi, I paid off my student loans, due to this my credit score dropped 56 points - this has drastically hurt my chances of getting a loan and buying a home. This should not have happened. I am being punished for paying off debt.",,"Nelnet, Inc.",CA,90008.0,,Consent provided,Web,2018-07-18,Closed with explanation,Yes,,2966543,226,1756,2966543,1
174356,2019-07-26,Credit card or prepaid card,General-purpose credit card or charge card,Getting a credit card,Card opened as result of identity theft or fraud,"XXXX confirmed a {$11000.00} overdue balance ( >120days ) from a Bank of America card fraudulently in my name. This has massive affected my credit and inability to open a new XXXX premier international credit card. I have NEVER done any business with Bank of America. Never visited any BOA branch, opened a BOA credit card, BOA debit card, or BOA bank account. I received a letter several months ago from BOA about an outstanding account. I called them to refute, spoke to a verified representative who said I did NOT have an account with them and to disregard the letter. This is Fraud, clearly. This is extremely distressing. The only banks I have used in the past few years are XXXX, XXXX, XXXX online, and recently XXXX. I do a lot online so assume someone stole my identity. I have no outstanding debts, no loans, no mortgages, and all credit cards on auto debit. I would not have defaulted on any payments. I know nothing about Bank of America and need this wiped from my credit immediately. I have also reported this to my brother, who is a business lawyer. XXXX said the last four digits of the account # is : XXXX. I have no other information since I never dealt with Bank of America.",Company has responded to the consumer and the CFPB and chooses not to provide a public response,"BANK OF AMERICA, NATIONAL ASSOCIATION",OH,44109.0,Servicemember,Consent provided,Web,2019-07-26,Closed with monetary relief,Yes,,3319765,1193,1383,3319765,1
158481,2019-08-19,Debt collection,Other debt,False statements or representation,Attempted to collect wrong amount,"The billing company for XXXX XXXX XXXX known as AAC has refused to close a membership account despite being given both a written 30 day notice and a verbal notice. I called to first give verbal notice that my account needed to be cancelled as I have been put on bed rest due to pre term labor. I was then informed a verbal notice was not enough and told to respond to an email to give ""written"" notice. I did as requested and was under the impression my account had been terminated . Now through a number of harassing emails I am being told I am to pay an additional $XXXX  fee for services that I have not received after the discontinuation date of my membership. I have informed them I will not pay for services not rendered and they have continued to threaten me through email with additional fees for non payment on a CANCELLED memberhsip.",,Affiliated Acceptance Corporation,CO,80918.0,,Consent provided,Web,2019-08-19,Closed with explanation,Yes,,3346240,843,1359,3346240,1
1260670,2016-04-15,Student loan,Non-federal student loan,Dealing with my lender or servicer,Having problems with customer service,This loan was cancelled and classified as income on my 2014 tax return,,JPMORGAN CHASE & CO.,FL,33422,,Consent provided,Web,2016-04-15,Closed with explanation,Yes,No,1880578,70,2580,1880578,1
1235831,2021-07-10,Debt collection,Credit card debt,Attempts to collect debt not owed,Debt was result of identity theft,Collection trying get my money danger my credit score because account is opened fraudulent out my concerns trying fixed error with this company credit one now send me collection,,Resurgent Capital Services L.P.,RI,2908.0,,Consent provided,Web,2021-07-10,Closed with explanation,Yes,,4530079,177,668,4530079,1
519805,2020-07-27,"Credit reporting, credit repair services, or other personal consumer reports",Credit reporting,Incorrect information on your report,Information belongs to someone else,I have several items on my credit report that are not mine. I noticed it because I recently applied for a credit card and I wasn't approved so it prompt me to check my credit report. These items listed are not mine and need to be deleted from my credit report,,"EQUIFAX, INC.",FL,33309.0,,Consent provided,Web,2020-07-27,Closed with explanation,Yes,,3766225,259,1016,3766224;3766225;3766226,3
165403,2016-11-22,Mortgage,Conventional fixed mortgage,"Loan servicing, payments, escrow account",,"I am paying off my loan by making largish payments frequently to the company who bought my mortgage. XXXX had it before and now Nationstar Mortgage holds it. The problem is that they take payments for the future out of the principal payment every time. I have called them every time and talked to customer service agents, who are uniformly nice on the phone. However, the problem just does n't go away. I know that they are taking out interest fees for each payment that they have not earned yet. They fix it each time, so I know it is n't violating their own policies to pay off a loan early ( my loan does n't and never did have an early payment penalty ). I do n't know why it should be so easy for them to continue to do this to people. I think they should not be allowed to even be in this business. I have a PhD and have taught university courses that involved finance, compound interest, and payment schemes, and I know that this should be illegal, but apparently is n't. Most people do not have the time to call over and over about problems with this company. I would like to see them put out of business and money paid back to people who can not afford the fees and the hidden costs of doing business with them.",,NATIONSTAR MORTGAGE LLC,FL,34667.0,Older American,Consent provided,Web,2016-11-22,Closed with explanation,Yes,Yes,2221034,1220,2359,2221034,1
1184491,2015-10-20,Credit reporting,,Incorrect information on credit report,Account terms,The account was deleted by XXXX And Transunion because is from XXXX And more the 7 years has passed but the creditor reinstalled them with a different balance. But it is the same account .XXXX,Company chooses not to provide a public response,"TRANSUNION INTERMEDIATE HOLDINGS, INC.",PR,918.0,,Consent provided,Web,2015-10-20,Closed with explanation,Yes,No,1615152,192,2758,1615152,1
1286954,2022-06-18,"Credit reporting, credit repair services, or other personal consumer reports",Credit reporting,Improper use of your report,Reporting company used your report improperly,"after a check of my credit report i ask the credit bureaus to do a detailed verification of these accounts, all came back verified. after checking, i find multiple inconsistencies and errors with these accounts after they claimed to have did their checks, i also did not authorise in writing that these accounts be posted. 

in accordance to the fair credit reporting act XXXX account has violated my rights. 

XXXXXXXX XXXX XXXX XXXX XXXX XXXX XXXX XXXX XXXX XXXX XXXX XXXX XXXX XXXX XXXX XXXX XXXX XXXX 15 U.S.C 1681 section 602 A states i have the right to privacy 15 U.S.C 1681 section 604 A section 2. also states a consumer reporting agency can not furnish a account without my written instructions.",,"EQUIFAX, INC.",FL,33025.0,,Consent provided,Web,2022-06-18,Closed with explanation,Yes,,5685339,705,325,5685339;5685345,2
